slang	formal
tukan perbaikin brrt luu cock hallow	tukang memperbaiki berarti lu cocok halo
apose betuuuuulllllllllllllllll jelek2 favoriteeee krudung	apa betul jelek-jelek favorit kerudung
beratttttttt dr liaat pd personill imoetz	berat dari  lihat pada personil imut
iyaa orgtuanya thnan nyindirin pa2 ngobatin	iya orang tuanya tahunan menyindir apa-apa obati 
smgaa poooolllll gg	semoga pol enggak
toloollll miripp ket merekaaaa	tolol mirip keterangan mereka
caantiiik moso didapet aseekk	cantik masa didapat asyik
bosen2 dijkt mudah2an	bosan-bosan dijakarta mudah-mudahan
astagfirullh nuduh mokad	astagfirullah menuduh mati
khadiran dumsss coeg berantem lahh otot2	kehadiran dong jancuk  bertengkar  lah otot-otot
waww ngelamar gr2 mksd setujuuuu loe	wow melamar gara-gara maksud setuju lo
ajhh kklau becanda kageet	saja kalau bercanda  kaget
terrrrbaik mayann bnerr	terbaik lumayan benar
tuk mukanyaa rempong nggeh	untuk mukanya repot engah
ongkir apes melihara bwhn llki doeloe	ongkos kirim sial memelihara bawahan lelaki dulu
22nya ngambek hrgny	dua-duanya mengambek harganya 
dlam applikasi sambel	dalam aplikasi sambal 
jadul pling liatin	jaman dulu paling memperlihatkan
kebayanyaa qo geetoo	kebayanya kok begitu
sering2 jirr donkk suko cba	sering-sering anjir dong suka coba
syp wkt ngurusin gt anjingnyaa	siapa waktu  mengurusi begitu  anjingnya
asyikkkkk sampek kageeet cakepp pinginnn gemesnya	asyik sampai kaget cakep ingin gemasnya
brjln jrnk suamiii aj dateng	berjalan  jarang suami saja  datang 
klen hayukk tmpat hubunggi yaolohh	kalian hayo tempat  hubungi ya allah
canttttikkk tai ancur2an indoneaia canteek ganti'kn	cantik tahi hancur-hancuran indonesia cantik menggantikan
selaw kngenn hr jawabanny bangetttttttt dftr	santai kangen hari  jawabannya banget daftar
mao edaaann pait brgkt cakep terharuuu	mau edan pahit berangkat  cakap  terharu
pilem looohh jgan mukax wdooohhh brisi	film  loh jangan  mukanya waduh berisi
lainnn next pdhl okz	lain lanjut padahal  oke
keles koment sbelum pisan mk	kali komentar sebelum sangat maka
gimanaaaa hy laaaah cuaantik	bagaimana hai lah cantik
nyambet mksd pilkada	menyambat maksud pemilihan kepala daerah
liatnya klk mbg doyan ngeri2	lihatnya kelak mbak suka  ngeri-ngeri
pacarane pengikuy suaminy sayyy subahanallah kiriii	pacarannya pengikut suaminya say subhanallah kiri
sbbyak dstu oprasiya kakkk	sebanyak disitu operasinya kak
ajibb cabal nyaaaa nawarin nontonya	ajib sabar  nya menawari menontonnya
ori alissnyaa kenalin gemesinnnnn	orisinal alisnya mengenalkan menggemaskan
imho dmkn tante2 yapp	in my humble opinion dimakan  tante-tante ya
lmyan maneh sdri tuany ath	lumayan mana  sendiri tuanya kalau begitu
suksess togel kyny kapan2 gkhianati sitayngin	sukses toto gelap sepertinya  kapan-kapan mengkhianati ditayangkan
termurahhh perilakuny kejuu mereka2 kaaaaa	termurah perilakunya keju mereka-mereka kak
denger mudah2an bcoz nusuk	dengar  mudah-mudahan karena menusuk
nmbh jadulnya jgn2 dsini artis2 romantisny	tambah  jaman dulunya jangan-jangan disini artis-artis romatisnya
papahhhnya tetp pkoknya kencng	papahnya tetap pokoknya kencang
yuu mager kabor nyatakan	yuk malas bergerak kabur menyatakan
nyerocooooos nyukur bokep tls	mencerocos cukur  porno tulis
bangat cwo iyap hbd	banget cowok  iya happy birthday
mbk kerreeen hubngan bcs	mbak keren hubungan karena 
tlpn seterong niyh doku	telepon  setrong nih uang
mano lngsing nnti mlepaskan owalaah	mana  langsing nanti  melepaskan walah
mantaff jwab bgitu dumsss jmt wk	mantap jawab begitu dong jumat  waktu
anak2mu buser karya2 apikkkk	anak-anakmu buru sergap karya-karya apik
karir.a diluangin selow kocaaaakkk mamer	karirnya diluangkan sebentar  kocak memamerkan
seeeemua kalok ingeet kyny temen2	semua kalo ingat sepertinya  teman-teman
miriiippp ngmgin takuuuuut shbat migas	mirip mengomongkan takut sahabat minyak dan gas bumi
nyerocooooos asikkk cerdiik kepikir lyt ngucapin	mencerocos asik cerdik terpikir lihat mengucapkan
sukaaa diakibtkn bngks cantikkkkkkkk ywdh	suka diakibatkan bungkus  cantik ya sudah
mgkn sbntr narsis djln iyak dipikirin	mungkin sebentar  bangga pada diri sendiri di jalan  iya dipikirkan
palinf sok2an nyerocos bikinnn	paling sok-sokan mencerocos bikin
stu alloh jidad pla sich kepda	satu allah jidat pula sih kepada
telkom ada2 barengg lucu2 sudab cabol	telekomunikasi ada-ada bareng lucu-lucu sudah cabul
baaiikkk nyariin gara2 merhatiin lb light	baik mencari gara-gara memperhatikan  lembar  terang
kenyataan2 mslh bangeer kreean bingiiittttzzzz bngtttt	kenyataan-kenyataan masalah banget keren banget banget
diajarin branjak ngegosip cwok palgi	diajari beranjak gosip  cowok apalagi
nyuci nuduh kaliii	cuci  menuduh kali
bnggain makny lansia ngerampas dimaafin mumet	banggakan maknya lanjut usia merampas dimaafkan pusing
bloghhh ajha plg mst botakkkk	goblok saja pulang mesti botak
uga dpnrmh gara2 cieeee msa hasilnyaaa	juga depan rumah  gara-gara cie masa hasilnya
kurng uuuuuaaaaaaaaaappppppppppiiiiiiiiiiiiiiiiiikkkkkkkkkkkkkkkk ksn kakanya	kurang apik kesana  kakaknya
bknnya mang kmauan	bukannya memang kemauan
yaelahhh slh blkng amienn tinggall dbnding	alah salah  belakang amien tinggal dibanding
ngehujat gilaaaaaa hrs brgkt bres	menghujat gila harus  berangkat  beres
apa2 iyaa bgtt lahhh ketemuuu janka	apa-apa iya banget lah ketemu jangka
iooo bangets aamiiin dooong	lo banget amin dong
akko dipendem gatau tar setabil ntikk	aku dipendam  tidak tahu entar stabil cantik
ucul coz nyampein	lucu karena menyampaikan
matii piiink miapah gokilll segitunya	mati pink demi apa gila sebegitunya
than blkngny jalanani pk	tahan belakangnya  menjalani pakai
pollll imho lucuuuuu hampasss	pol in my humble opinion lucu hempas
bencong grgr sichhhhhhhhhh mampuussss ngaruh kaliannnnnn	banci gara-gara sih mampus berpengaruh kalian
gimna lutunaa nontoonnn aaaaahhhh brb tah	bagaimana lucunya menonton ah segera kembali teh
katrok kasat acra nyakiti akn helloo	kampungan kepala satuan acara menyakiti  akan halo
yng bngkit deg2an allahh bawa2	yang  bangkit deg-degan allah bawa-bawa
caantiiik bellain denger prawatan cobain q	cantik membela dengar  perawatan coba saya
jagain gretongan faham hedeuuhh	jaga gratisan paham  aduh
itung belanjaa hums nikahin	hitung belanja rumah menikahi
waduhh nangisss sohib bbrp nggeh merhatiin	waduh menangis teman beberapa engah memperhatikan 
soale kgiatan amaca klk	soalnya  kegiatan ah masa kelak
cali peen cantikkkm lbur ckup	caci ingin cantik libur cukup 
cmpr lnjt tinggalin dlam protestin	campur lanjut  tinggalkan dalam protestan
amiin cmn nangiiis cukurrr yakinn kibus	amin hanya  menangis cukur yakin kaki busuk
nal doeloe pasien2nya mudaa ilmh naaahhh	kenal dulu pasien-pasiennya muda ilmu nah
lipetan jalanin astagaaaaaaaa ngeuh	lipatan menjalani astaga engah
hubngan indonesiaaa lov gbs	hubungan indonesia cinta enggak bisa
suk ud uuhhh abanggku sukaa pnjang	suka sudah  uh abangku suka panjang
mpe naek aps gemesss	sampai naik apa gemas
kaliannnnnnn emank bhagia hijaabbb bynk jawabanya	kalian memang  bahagia hijab banyak  jawabannya 
wahhh naggung maluuuu aplks bpkmu	wah menanggung malu aplikasi bapakmu
ajha nambah benar2	saja tambah  benar-benar
trima orang2 amiiiin apva cantiknyaaa	terima orang-orang amin apa cantiknya
hati2 iiihhhhh k	hati-hati ih kak
tuir ngeluh adlh	tua keluh  adalah
tmpt dikatain romntis ranmor	tempat dikatai romantis kendaraan bermotor
ngets skrg bener2 yupz	banget sekarang  benar-benar ya
aduuhhh keukeuh comntr syediiihhh	aduh keras kepala komentar sedih
soal'y neko2 cwe	soalnya neko-neko cewek 
yach pansus sprtny melulu sumai	ya panitia khusus sepertinya  selalu  suami
lgunya dehh koplak	lagunya deh kocak
macem punn jdi	macam pun jadi 
lupain ampunnnn trhtung lengkapp mlt.a	melupakan ampun terhitung lengkap mulutnya
laenny bazis tirani	lainnya badan amal tiran
ngitem skola sptny	menghitam sekolah  sepertinya 
mudah2an jwbny nyalahin krn mauu	mudah-mudahan jawabannya  menyalahkan karena  mau
brdiri houm dieee	berdiri rumah dia
mauu bgntdr mg cantiiikkk	mau bangun tidur  moga cantik
merekaa tegaar mbahh haqq musti sipp	mereka tegar mbah hakiki  harus  sip
tnh cadas telkom tdnya dst ciee	tanah keren telekomunikasi tadinya dan seterusnya cie
kaliiin keciil ngertii	kalian kecil mengerti
mikol bl atassss	minuman beralkohol beli  atas
bndr eyke amiiiiinnnnn jrnk ngakaaaakkk kanggggg	bandar  aku amin jarang mengakak kang
sikap2 lbih brsma ngamatin	sikap-sikap lebih  bersama mengamati
sukam omongin prodaknya maw kecil2	suka mengomongkan produknya mau kecil-kecil
jh hellow gi	saja halo lagi
segerr gawe nikahin	segar kerja  menikahi
ngaku2 seeeemua sllu helow tmn	mengaku-ngaku semua selalu  halo teman 
tembokk kll munaslub	tembok kalo musyawarah nasional luar biasa
ngedukung nahannnn euyyyyy dekkk kcewa termurahhhh	mendukung tahan euy dek kecewa termurah
siiiiiiippppppppp dl tullus	sip dulu tulus
owh hayalanku lama2	oh khayalanku lama-lama
met rasaiin kosan ngasih2 syang greged	selamat rasai kost  mengasih-ngasih sayang greget
kmanusiaan nimpuk puter ahhhh trus saayyyyy	kemanusiaan menimpuk putar  ah terus  say
digituin diladenin nyender suaranyaaaaaa	dibegitukan diladeni menyandar suaranya
doonk selmat mudah2n gataunya ktdrn byrin	dong selamat mudah-mudahan enggak taunya ketiduran  bayarkan
tll bntr ujan2an yaa banger	terlalu sebentar  hujan-hujanan  ya banget
karoke kasubbag gan menjelekan sukakkk	karaoke  kepala subbagian juragan menjelekkan suka
aminn2 senang2 artine	amin-amin senang-senang artinya 
cabut bangettttttt terbaeeeek bt pilkada kale	pergi banget terbaik buat pemilihan kepala daerah kali
mngikuti nii ngehadepin	mengikuti ini menghadapi 
dedeknya tidakkkk inia kll sayaang	adeknya tidak ini kalo sayang
ngaku anjimmm ibliss skrang tangkep	mengaku anjing iblis sekarang  tangkap
sangattt jodohny dipermainin hidupppp sekolahin	sangat jodohnya dipermainkan hidup sekolahkan
love kebnyak'an kangenn gombal biasaaaa ihhh	cinta kebanyakan kangen suka merayu biasa ih
bngttt iu ska tmsk mamer	banget itu suka termasuk  memamerkan
coyyy kaka ngajuin tipi luchuw	coy kakak mengajukan tv  lucu
trnsfr cadas tiba2	transfer  gaul tiba-tiba
jdii krg lt	jadi kurang  lantai
mahhhh cintaaaaaaa hnya	mah cinta hanya
jm kt2 anjirr magabut ciieeeeeee	jam  kata-kata anjir makan gaji buta cie
ajaibbbbb terong2an huum urat2nya gantheng	ajaib terong-terongan iya urat-uratnya ganteng
kmr jgn naon bangkret mrip dg	kamar  jangan  apa bangkrut mirip dengan 
curcol huff tnyt	curahan hati colongan mengeluh ternyata 
kejuu mrusak penghianat	keju merusak pengkhianat 
ngembali kamuu sm2 ngambek	kembali kamu sama-sama mengambek
sosek ganteng2 ternodain keinget igtlah ngets	sosial-ekonomi ganteng-ganteng ternodai teringat ingatlah banget
hadirrr cannntikk dst gmana	hadir cantik dan seterusnya bagaimana 
huum mdh narkoba	iya mudah  narkotika
nikmatin apes ngebully diingetin sbaiknya	menikmati sial intimidasi diingatkan sebaiknya
siippp nyaaaaaaaaaaaaa cwnya kren	sip nya ceweknya keren
hayalanku bisi jangan2	khayalanku kalau-kalau jangan-jangan
silahkn segala2ny gilaaaa iye belom expresi	silakan segala-galanya gila iya belum  ekspresi
mikirinnn gtu2an pluk	memikirkan begitu-gituan peluk
jg dmna dapah pntng plampiasannn aminnnnn	juga  dimana  ada apa penting  pelampiasan amin
bela2in sayaang gratisss kayakk maneh didenger	membela-bela sayang gratis kayak mana  didengar 
kslahan menghilangkn shap samaaaa jml blegug	kesalahan menghilangkan siap sama jumlah  bodoh
iiiiiiiii bknnya kemaren	ih bukannya kemarin 
gakkk komenx ssorg	enggak komennya seseorang
diluangin otw begete	diluangkan on the way banget
cakeeeeppp temen bawak cem	cakep teman  bawa macam
badingkan merka mnganalisa mutuain ms2	membandingkan mereka menganalisa memutuskan masa-masa
murahhh wenak badaaiii	murah enak badai
cucokkk smlmn nyia2in can gemez	cocok semalaman  menyia-nyiakan belum gemas
disiniii lngkp jd bedanyaaa	disini lengkap  jadi bedanya
pelatnas bwhn kepppoin	pemusatan latihan nasional bawahan kepoi
sy nyerocooooos nt tuwanya mendingan critamu	saya  mencerocos nanti tuanya lebih baik ceritamu
trasa buruann ktergantungan kirain iniiiiiiiiiiiiiii kasar2	terasa buruan ketergantungan mengira ini kasar-kasar
nyatakan yuuuukkk ngadu kayahhh	menyatakan yuk mengadu kaya
hargs terkenall alhamd tnggu	harga terkenal alhamdulillah tunggu
moga lluu indoneaia	semoga lu indonesia
penertiban yaakkk cw ngatai duuuhh	tertib ya cewek  mengatai duh
dianterin duluu ngepoin	diantar dulu mengepoi
ngajarin ngehujat ihhhh	mengajari menghujat ih
ajha lepasin sedangkn smuaaa fotony astagaaa	saja melepas sedangkan semua fotonya astaga
nyampein udh sambel	menyampaikan sudah  sambal 
ngrti niih mndg	mengerti nih lebih baik
pengalam dluan sbelum nempel dbyr bngett	pengalaman duluan  sebelum menempel dibayar  banget
otda comen mantapppppp mmberikn manisnyaaaa	otonomi daerah komen mantap memberikan manisnya
ngehe sbuah gilakkkkk nambah coret2 palingann	kesal sebuah gila tambah  coret-coret palingan
emang than jnj	memang  tahan janji
kerennn ngmgin tgl hbng	keren mengomongkan tanggal hubungi 
maksir filmny sesekk malu2in maki2	menaksir filmnya sesak malu-malui maki-maki
jdikan markus ilang2 cucokkk trmksh	jadikan makelar kasus hilang-hilang cocok terima kasih
nape cocokkk gr apain slmat jink	kenapa  cocok gede rasa apai selamat anjing 
waaaww tngu deeh nanget msti kcil	wow tunggu deh banget harus  kecil
gra2 apz naaaa diluarann	gara-gara apa nya diluaran
kloop mndgn hrsny penyebab2	klop lebih baik harusny penyebab-penyebab
wk sdah kokkk	waktu sudah  kok
passs pcarny maksd	pas pacarnya maksud
gg aaamiiinnn sama2 smpe tipiwan	enggak amin sama-sama sampai  TvOne
bentarr malem terbaiiikkkkk gokilll	bentar malam terbaik gila
hallooo gan kepikiran nyebutin ntar	halo juragan terpikirkan menyebutkan nanti 
gak baguusss imoet crt	tidak  bagus imut cerita 
stu salting smentara cumi	satu salah tingkah sementara Cuma miscall
nawarin katanyaa loe	menawari katanya lo
jem terimaksih niiiihh aaaaaaakkk	jam  terima kasih nih ah
kmbali didengerin cantip tips2 alow iihh	kembali didengarkan cantik tips-tips halo ih
loncattt komen2 sp cannntikk kenyataan2 kaliannn	loncat komen-komen siapa cantik kenyataan-kenyataan kalian
masukin bawa2 trserah stagahhhh	memasukkan bawa-bawa terserah astaga
nnt shap ayooook prsatukn	nanti siap ayo persatukan
brusaha pensaran info kepda srta	berusaha penasaran informasi kepada serta
jdnya telimakacih iiiiiiiiii kaitannha kangeeeennn	jadinya  terima kasih ih kaitannya kangen
hehe fakta2 jls2 buanget	he fakta-fakta jelas-jelas banget
cantikkkkk week ud	cantik wig sudah 
hotx dihpus mepet ilang-in kuaaatt	hotnya dihapus dekat sekali hilangkan kuat
iiihhhh nontoonnn pgn ckck mka	ih menonton ingin  ck maka 
tkg trjd manisnyaaaa lansia sabal jk	tukang terjadi manisnya lanjut usia sabar jika
bnyak ngoceh aduhhhhhhhhh ngasih mnambh	banyak  mengoceh aduh mengasih menambah
komuk tahun2 pipinyaaa stju maho	muka tahun-tahun pipinya setuju manusia homo
tdny nyekar msknya jd	tadinya  menyekar masaknya jadi
amuh belooomm ceritax azekkkk	kamu belum ceritanya asik
sbl sialannn abanggg lohhhh bingiiittzz	sebelah  sialan abang loh banget
woooiiiiiiii asikkk krn amiinnnn rasane ngadu	woy asik karena  amin rasanya  mengadu
oalaaaa jwbn buad	walah jawaban  buat 
nyindirin yl syukaaakkk sna papiii nangiiis	menyindir yang lain suka sana papi menangis
nangiiiiis mmbela kayanya saudra kenalin tirani	menangis membela kayaknya  saudara mengenalkan tiran
diksi okz adl gossip2.an subhanalloh alay	dikasih oke adalah gosip-gosipan subhanallah norak
muuuu ae kek nangiis slh jnj	mu saja kayak menangis salah  janji
ktemu uda smnjak ngemeng liatiii lutuna	ketemu sudah  semenjak mengomong lihat lucunya
ngeuh jelasssss shaaaay adekx	engah jelas say adeknya
kacauuuu krenz kptsan lagian keburu	kacau keren keputusan lagi  terlanjur
cemungudh nama2 guoblok ajjh kamsud cowwyy	semangat nama-nama goblok saja maksud  maaf
ka pans hidupppp	kak fan hidup
ex kamtibmas sendri ithu	mantan keamanan dan ketertiban masyarakat sendiri itu
skrang gosah wanitah aquwh syekaliii ya	sekarang  gak usah wanita aku sekali iya
mengherthii mgu sabaro ksyngn jendesss	mengerti minggu sabar kesayangan janda
bleh duhh trbukti smkin romantiz ngilangin	boleh duh terbukti semakin romantis menghilangkan
kmbl ngumpat2 sempet baso ngebiarin ngabis2in	kembali mengumpat-ngumpat sempat bakso  membiarkan menghabiskan
jgk sbagai perubut kejuu prwtn	juga sebagai perebut keju perawatan
diapain garem gingsungny lagiiii lekong	diapakan garam  gingsulnya lagi laki
nyesek kasiian kesinii ber'expresi mnisss	sesak  kasihan kesini berekspresi manis
ap2 cmn nyebutin nyesel gabisaa	apa-apa hanya  menyebutkan menyesal tidak bisa
bandingin hidiyah donx recommendasi cantiiiikk	bandingkan hidayah dong rekomendasi cantik
b4 gemez smngat jawabanya kaliiii	sebelum gemas semangat jawabannya  kali
tuhhh beginii protestin pokonya	tuh begini protestan pokoknya
mgkin flm tar	mungkin film entar
yowes kepengen bagaimna misal'a	ya sudah ingin  bagaimana misalnya
lgkah2 sambel ampunnnnn ngmgin hy bdampingan	langkah-langkah sambal  ampun mengomongkan hai berdampingan
hngga pollll dstu	hingga pol disitu
barang2 seluru biasaaa	barang-barang seluruh biasa
azeeeek uwee buseett cwo	asik gue buset cowok 
ayahh anak2e bais bisaaa	ayah anak-anaknya habis bisa
nulis jngn bagiin	menulis jangan  bagikan
nyobain adl kesinii kwatir aurot	mencoba adalah kesini kawatir aurat
otw ciumman ngerii edaaann hub fhotonya	on the way ciuman ngeri edan hubungi fotonya
dua2nya cukurrr kcantikan	dua-duanya cukur kecantikan
selmt botakin berbakiti cantiik	selamat botaki berbakti cantik
terharuuu haha sdng smangat ngintip	terharu tertawa sedang  semangat mengintip
yok mslh makn palinf	yuk masalah makan  paling
novembr ente yawda hiri gilaaaa	november anda  ya sudah hari gila
hallooo looh sia2kan	halo loh sia-siakan
gimna ilfil ati2 namax pusingggg	bagaimana tidak suka hati-hati namanya pusing
lg lwt adlh mutusin	lagi  lewat adalah memutuskan
ditutupin cobain cantikkk dimarahin gowes kaaaaaann	ditutupi coba cantik dimarahi mengayuh sepeda kan
kmbang kluar narsis	kembang keluar bangga pada diri sendiri
tren kereeeeen krn	trend keren karena 
sexi2 brani mampuussss gowes	seksi-seksi berani mampus mengayuh sepeda
temenin kpn ciusss maak koplak lutunaa	temani  kapan  serius mak kocak lucunya
kejadianny gx ninggalin	kejadiannya tidak tinggalkan 
mnghina cemburuu dpan	menghina cemburu depan 
uda ngatain tp	sudah  mengatai tapi
ayuk tmpah azekkkk	ayo  tumpah asik
nyetel segitunya smrg	setel  sebegitunya semarang
musda beud makaci bangt2 mulutnyaaa tgk	musyawarah daerah banget terima kasih banget-banget mulutnya tengok
hlg ngantri sekalii khidupan	hilang  mengantri sekali kehidupan
elu ptg yup woooyy	lu penting  ya  woy
lsg fax mcm mukae prcya	langsung  facsimile macam mukanya percaya
ngareppppp orang2nya awk emng sumvahh cipika cipiki	mengharap orang-orangnya awak memang  sumpah cium pipi kanan cium pipi kiri
jdikan ayank bgmana pkai tngu kabag	jadikan sayang bagaimana pakai  tunggu kepala bagian
jwban gatel tutupin dsar mlh pnjual	jawaban gatal  menutupi dasar malah penjual
dl dengarin smbhyg abiz	dulu mendengarkan sembahyang  habis
cemungudh edaaaan ngolokin jwb	semangat edan mengolok jawab
pmbhasan bisya agk knlan mgk	pembahasan bisa agak kenalan mungkin
trgntng aq bilng batesin iyach	tergantung  aku bilang batasi iya
kelas'a uaaasssiiiik ngatur ihh mudaa kmpret	kelasnya asik mengatur ih muda kampret 
miriiippp ntar sebaik2 khan pjg prtamax	mirip nanti  sebaik-baik kan panjang pertamanya
cllw banyak2 kecakepan amiiinn	selalu banyak-banyak kecakapan  amin
mrangkul pemda ngerjain th2	merangkul pemerintah daerah mengerjakan  tahun-tahun
brsyukur telpon enakkkkk sbgi pait guoblok	bersyukur telepon  enak sebagai pahit goblok
bl sbnrny dimarahin	beli  sebenarnya  dimarahi
lemes bloghhh ngentotin anjrit	lemas  goblok senggama anjing
remang2 sbhabat drpada	remang-remang sahabat daripada
bape gemmeeezzz gataunya mng pla ngkkkkkk	bawa perasaan gemas enggak taunya menang  pula mengakak
mudah2 klahiran ndukung pastii koq	mudah-mudah kelahiran mendukung pasti kok
loncatt cntk epe dimasukin ngmps sabi	loncat cantik apa dimasuki ke kampus bisa
mff kecakepan punyaaa slalu pcar	maaf kecakapan  punya selalu  pacar
nyakiti sape prcuma kayaq pg kepeleset	menyakiti  siapa  percuma kayak pergi  kepleset
peduliin cape amin2 iiihhhhh ladenin	mempedulikan capai  amin-amin ih meladeni
duuuhhh ngaji smbil kereen	duh mengaji sambil keren
banpol ketarik iiihhhh trlalu	bantuan polisi tertarik ih terlalu
bulcit tipe2 cekal	omong kosong tipe-tipe cegah tangkal
diksi mhsw buanget	dikasih mahasiswa  banget
tnda sk qaqaaaa luuuaar	tanda suka kakak luar
jangan2 hancurin jauhh	jangan-jangan menghancurkan jauh
hebatt yach klh mikir2 yaak eps	hebat ya kalah  memikir-mikir ya episode 
yaah cew gueeeee clbk bazis	ya cewek gue cinta lama bersemi kembali badan amal
bangkotan kmps pjg	tua kamus  panjang
cengengesan pala mndptkn muuv mkan	tertawa kepala mendapatkan  maaf makan 
ademmm promoo gn brsama	adem promo begini bersama
telefisi mukae kenape	televisi mukanya kenapa 
imuutt gausah teruz	imut tidak usah terus
idiiot ngerendahin akuh allaahh bermaksut bangga2in	idiot  merendahkan aku allah bermaksud membangga-banggakan
renstra bndr bgt lhir	rencana strategis bandar  sangat  lahir
bandes gmna ok	bantuan desa bagaimana  oke
sehat2 brjdh yachhh	sehat-sehat berjodoh ya
kaliii dmnmn gagahx mndg	kali dimana-mana  gagahnya lebih baik
ntn kebayanyaa kdg	nonton  kebayanya kadang 
gtau ketuker mskpn dsna cuman giniin	enggak tau tertukar meskipun disana hanya beginikan
ktanya alissnyaa tsadeest	katanya alisnya sadis
pollll tikung2 jls2 jd'y kaaakk amiiiiiiiiiinnnnnnn	pol tikung-tikung jelas-jelas jadinya kak amin
wat ortunya ad ladenin nentuin	buat orang tuanya ada meladeni menentukan
matany gpp hbs terkenall jancoeg congor	matanya enggak apa-apa habis  terkenal jancuk  mulut
testinya silahkn gak papa	testimoninya silakan tidak apa-apa
dsna ngorbanin tah yowes	disana mengorbankan teh ya sudah
males dimintak tantee terburu2 mateng	malas diminta tante terburu-buru matang 
tamvann tengah2 kemarn ka dalil2 bngun	tampan tengah-tengah kemarin kak dalil-dalil bangun
nyariin mrekaaaa ternodain	mencari mereka ternodai
katrok senenggg mudah2n smentara	kampungan senang mudah-mudahan sementara
pait slalu seruuu orabg nti	pahit selalu  seru orang nanti 
natap aspal faham	menatap asli tetapi palsu paham 
kabor sateny taek nmnya apz ngerampok	kabur satenya  tahi namanya apa merampok
cmpur ngertii ngeliatin cemunguth boker aljasa	campur mengerti melihat  semangat berak asal jadi saja
ntap jng geneeee lengkapp	mantap jangan  begini lengkap
ampe amiiiiin nyasar genggg	sampai amin tersesat geng
amiiinn dblkang ngibul ok daah nangiss	amin dibelakang berbohong oke dah menangis
kagak kerenn gokillllll kepikir	tidak  keren gila terpikir
astagfirrullah ributin cooocok caiank tmn2nya brsama	astagfirullah meributkan cocok sayang teman-temannya bersama
gw smbuh nontonnnn pengen silauuu mdh2an	saya  sembuh  menonton ingin silau mudah-mudahan
tipiwan adek2 lemot mmantab krikil bangetttt	TvOne adek-adek lambat mantap kerikil  banget
kesel cukurrr ndiri bergunaa khwtr imba	kesal  cukur sendiri berguna khawatir  jago sekali
sygku perhatiin hardcore	sayangku  perhatikan keras
hujatann udd aja grunya	hujatan sudah saja  gurunya
amiinnnn ngerebut coz tahun2 taux pukulin	amin merebut karena tahun-tahun taunya pukuli
maksir mnyngkn diam2 kaleee	menaksir menyenangkan  diam-diam kali
ngata2in wlawpun takuuuuut merekaa	mengata-ngatai walaupun takut mereka
sukaaa ati2 slw	suka hati-hati selow
ngebedain dalil2 knlan nganteng tbuh	membedakan dalil-dalil kenalan ganteng tubuh
ngolokin ntappp cini sukakkk bro hubdar	mengolok mantap sini suka saudara laki-laki perhubungan darat
baek dsb komentnya kencqng	baik dan sebagainya komentarnya kencang
kedubes anjg ponpes mkn sdri	kedutaan besar anjing pondok pesantren makin sendiri
mngira dtmbh bhwa maho mauuuuu yuh	mengira ditambah  bahwa manusia homo mau tuh
rupa2nya dmnmn ciusss trbaikk	rupa-rupanya dimana-mana  serius terbaik
cogan khwtr nangiiis	cowok ganteng khawatir  menangis
luthu pasangn bnr2 klwrga	lucu pasangan benar-benar keluarga
k' jendral kaliii nganterin bsa	kak jenderal kali mengantarkan bisa 
cerdass gaprgi nuntut jdnya	cerdas enggak pergi menuntut jadinya 
hadahhhhhhhh ngumpul pling	aduh berkumpul paling
sebenernya gi kpgn	sebenarnya  lagi ingin 
kaaa kasat mdh2an laki2 khdpn bangga2in	kak kepala satuan mudah-mudahan laki-laki kehidupan membangga-banggakan
kelus lagihh smbh nguburin	kali lagi sembuh  menguburkan
jamam bngetttt apasih lanjutin satupunn mskpn	jaman banget apa sih lanjutkan satupun meskipun
mintk kyny gamasuk malu2in seruu kebagi	minta sepertinya  tidak masuk malu-malui seru terbagi
nyari org2 kharismanya serem2	mencari orang-orang karismanya seram-seram
keak diakibtkn kusem kpgn kata2nya pakke	kayak diakibatkan kusam ingin  kata-katanya pakai
ketauan djkt dipikirin mamz qm	ketahuan di jakarta  dipikirkan makan kamu
tante2 cama-cama dngar nungguin aaaaahhhh mahhhh	tante-tante sama-sama dengar  tunggu  ah mah
bnrn tercyduk bnggain sudab cibuq	benaran terciduk banggakan sudah sibuk
cimeng kaliannn ngalahin gakusah	ganja kalian mengalahkan enggak usah
seterong smbuh ru rpt2 trkena ngalah	setrong sembuh  baru repot-repot terkenal mengalah
ka serem akhlah nyantai kata2nya	kak seram akhlak santai  kata-katanya
smpt doa2 migas	sempat doa-doa minyak dan gas bumi
ad bnern sprti	ada benaran seperti
penyebab2 gakkk canti dimintak	penyebab-penyebab enggak cantik diminta
